============= POLITICS LOG =============

Port: 80
Packet: 10.0.10.88,200.132.35.220,80,TCP,66,47870 > 80 [FIN, ACK] Seq=1 Ack=1 Win=229 Len=0 TSval=3949291 TSecr=84685976,27,
Packet: 10.0.10.88,200.132.35.220,80,TCP,66,47872 > 80 [FIN, ACK] Seq=1 Ack=1 Win=229 Len=0 TSval=3949291 TSecr=84685976,28,
Packet: 10.0.10.88,200.132.35.220,80,TCP,66,47868 > 80 [FIN, ACK] Seq=1 Ack=1 Win=237 Len=0 TSval=3949291 TSecr=84687229,29,
Packet: 10.0.10.88,200.132.39.118,80,TCP,66,44526 > 80 [FIN, ACK] Seq=1 Ack=1 Win=229 Len=0 TSval=3949291 TSecr=1688290318,30,
Packet: 10.0.10.88,200.132.39.118,80,TCP,66,44528 > 80 [FIN, ACK] Seq=1 Ack=1 Win=229 Len=0 TSval=3949291 TSecr=1688290318,31,
Packet: 10.0.10.88,200.132.35.220,80,TCP,74,47888 > 80 [SYN] Seq=0 Win=29200 Len=0 MSS=1460 SACK_PERM=1 TSval=3949291 TSecr=0 WS=128,32,
Packet: 10.0.10.88,200.132.35.220,80,TCP,74,47890 > 80 [SYN] Seq=0 Win=29200 Len=0 MSS=1460 SACK_PERM=1 TSval=3949291 TSecr=0 WS=128,33,
Packet: 10.0.10.88,200.132.35.220,80,TCP,74,47892 > 80 [SYN] Seq=0 Win=29200 Len=0 MSS=1460 SACK_PERM=1 TSval=3949291 TSecr=0 WS=128,34,
Packet: 10.0.10.88,200.132.35.220,80,TCP,66,47870 > 80 [ACK] Seq=2 Ack=2 Win=229 Len=0 TSval=3949291 TSecr=84692104,36,35
Packet: 10.0.10.88,200.132.35.220,80,TCP,66,47872 > 80 [ACK] Seq=2 Ack=2 Win=229 Len=0 TSval=3949291 TSecr=84692104,38,37
Packet: 10.0.10.88,200.132.35.220,80,TCP,66,47888 > 80 [ACK] Seq=1 Ack=1 Win=29312 Len=0 TSval=3949291 TSecr=84692105,41,40
Packet: 10.0.10.88,200.132.35.220,80,TCP,66,47890 > 80 [ACK] Seq=1 Ack=1 Win=29312 Len=0 TSval=3949292 TSecr=84692105,44,43
Packet: 10.0.10.88,200.132.35.220,80,TCP,66,47892 > 80 [ACK] Seq=1 Ack=1 Win=29312 Len=0 TSval=3949292 TSecr=84692105,46,45
Packet: 10.0.10.88,200.132.35.220,80,TCP,66,47888 > 80 [ACK] Seq=419 Ack=417 Win=30336 Len=0 TSval=3949292 TSecr=84692106,51,50
Packet: 10.0.10.88,172.217.29.206,80,TCP,74,54580 > 80 [SYN] Seq=0 Win=29200 Len=0 MSS=1460 SACK_PERM=1 TSval=3949972 TSecr=0 WS=128,69,
Packet: 10.0.10.88,172.217.29.206,80,TCP,66,54580 > 80 [ACK] Seq=1 Ack=1 Win=29312 Len=0 TSval=3949982 TSecr=4182261346,71,70
Packet: 10.0.10.88,172.217.29.206,80,TCP,78,[TCP Dup ACK 72#1] 54580 > 80 [ACK] Seq=114 Ack=1 Win=29312 Len=0 TSval=3950034 TSecr=4182261389 SLE=917 SRE=918,90,
Packet: 10.0.10.88,172.217.29.206,80,TCP,66,54580 > 80 [ACK] Seq=114 Ack=918 Win=31104 Len=0 TSval=3950034 TSecr=4182261549,92,89
Packet: 10.0.10.88,172.217.29.206,80,TCP,66,54580 > 80 [FIN, ACK] Seq=114 Ack=918 Win=31104 Len=0 TSval=3950034 TSecr=4182261549,93,
Packet: 10.0.10.88,172.217.29.195,80,TCP,74,43016 > 80 [SYN] Seq=0 Win=29200 Len=0 MSS=1460 SACK_PERM=1 TSval=3950038 TSecr=0 WS=128,99,
Packet: 10.0.10.88,172.217.29.195,80,TCP,66,43016 > 80 [ACK] Seq=1 Ack=1 Win=29312 Len=0 TSval=3950054 TSecr=253448151,102,101
Packet: 10.0.10.88,200.132.35.220,80,TCP,66,47888 > 80 [ACK] Seq=837 Ack=832 Win=31360 Len=0 TSval=3950076 TSecr=84692890,107,106
Packet: 10.0.10.88,172.217.29.195,80,TCP,66,43016 > 80 [ACK] Seq=157 Ack=1419 Win=32128 Len=0 TSval=3950111 TSecr=253448399,109,108
Packet: 10.0.10.88,172.217.29.195,80,TCP,66,43016 > 80 [ACK] Seq=157 Ack=2837 Win=35072 Len=0 TSval=3950111 TSecr=253448399,111,110
Packet: 10.0.10.88,172.217.29.195,80,TCP,66,43016 > 80 [ACK] Seq=157 Ack=4255 Win=37888 Len=0 TSval=3950111 TSecr=253448399,113,112
Packet: 10.0.10.88,172.217.29.195,80,TCP,66,43016 > 80 [ACK] Seq=157 Ack=5673 Win=40832 Len=0 TSval=3950111 TSecr=253448399,115,114
Packet: 10.0.10.88,172.217.29.195,80,TCP,66,43016 > 80 [RST, ACK] Seq=157 Ack=5673 Win=40832 Len=0 TSval=3950111 TSecr=253448399,116,
Packet: 10.0.10.88,172.217.29.195,80,TCP,54,43016 > 80 [RST] Seq=157 Win=0 Len=0,118,
Packet: 10.0.10.88,172.217.29.195,80,TCP,54,43016 > 80 [RST] Seq=157 Win=0 Len=0,120,
Packet: 10.0.10.88,172.217.29.195,80,TCP,54,43016 > 80 [RST] Seq=157 Win=0 Len=0,122,
Packet: 10.0.10.88,172.217.29.195,80,TCP,54,43016 > 80 [RST] Seq=157 Win=0 Len=0,124,
Packet: 10.0.10.88,172.217.29.195,80,TCP,54,43016 > 80 [RST] Seq=157 Win=0 Len=0,126,
Packet: 10.0.10.88,172.217.29.195,80,TCP,54,43016 > 80 [RST] Seq=157 Win=0 Len=0,128,
Packet: 10.0.10.88,200.132.35.220,80,TCP,66,47888 > 80 [ACK] Seq=837 Ack=833 Win=31360 Len=0 TSval=3951339 TSecr=84694141,179,178
Packet: 10.0.10.88,172.217.29.206,80,TCP,74,54584 > 80 [SYN] Seq=0 Win=29200 Len=0 MSS=1460 SACK_PERM=1 TSval=3952488 TSecr=0 WS=128,213,
Packet: 10.0.10.88,172.217.29.206,80,TCP,66,54584 > 80 [ACK] Seq=1 Ack=1 Win=29312 Len=0 TSval=3952500 TSecr=3642265827,215,214
Packet: 10.0.10.88,172.217.29.206,80,TCP,78,[TCP Dup ACK 216#1] 54584 > 80 [ACK] Seq=114 Ack=1 Win=29312 Len=0 TSval=3952552 TSecr=3642265873 SLE=917 SRE=918,220,
Packet: 10.0.10.88,172.217.29.206,80,TCP,66,54584 > 80 [ACK] Seq=114 Ack=918 Win=31104 Len=0 TSval=3952552 TSecr=3642266034,222,219
Packet: 10.0.10.88,172.217.29.206,80,TCP,66,54584 > 80 [FIN, ACK] Seq=114 Ack=918 Win=31104 Len=0 TSval=3952552 TSecr=3642266034,223,
Packet: 10.0.10.88,172.217.29.195,80,TCP,74,43020 > 80 [SYN] Seq=0 Win=29200 Len=0 MSS=1460 SACK_PERM=1 TSval=3952554 TSecr=0 WS=128,228,
Packet: 10.0.10.88,172.217.29.195,80,TCP,66,43020 > 80 [ACK] Seq=1 Ack=1 Win=29312 Len=0 TSval=3952565 TSecr=3033994128,231,230
Packet: 10.0.10.88,172.217.29.195,80,TCP,66,43020 > 80 [ACK] Seq=157 Ack=1419 Win=32128 Len=0 TSval=3952621 TSecr=3033994350,235,234
Packet: 10.0.10.88,172.217.29.195,80,TCP,66,43020 > 80 [ACK] Seq=157 Ack=2837 Win=35072 Len=0 TSval=3952622 TSecr=3033994350,237,236
Packet: 10.0.10.88,172.217.29.195,80,TCP,66,43020 > 80 [ACK] Seq=157 Ack=4255 Win=37888 Len=0 TSval=3952622 TSecr=3033994350,239,238
Packet: 10.0.10.88,172.217.29.195,80,TCP,66,43020 > 80 [RST, ACK] Seq=157 Ack=4255 Win=37888 Len=0 TSval=3952622 TSecr=3033994350,240,
Packet: 10.0.10.88,172.217.29.195,80,TCP,54,43020 > 80 [RST] Seq=157 Win=0 Len=0,242,
Packet: 10.0.10.88,172.217.29.195,80,TCP,54,43020 > 80 [RST] Seq=157 Win=0 Len=0,244,
Packet: 10.0.10.88,172.217.29.195,80,TCP,54,43020 > 80 [RST] Seq=157 Win=0 Len=0,246,
Packet: 10.0.10.88,172.217.29.195,80,TCP,54,43020 > 80 [RST] Seq=157 Win=0 Len=0,248,
Packet: 10.0.10.88,172.217.29.195,80,TCP,54,43020 > 80 [RST] Seq=157 Win=0 Len=0,250,
Packet: 10.0.10.88,172.217.29.195,80,TCP,54,43020 > 80 [RST] Seq=157 Win=0 Len=0,252,
Packet: 10.0.10.88,172.217.29.195,80,TCP,54,43020 > 80 [RST] Seq=157 Win=0 Len=0,254,
Packet: 10.0.10.88,200.132.35.220,80,TCP,66,47890 > 80 [FIN, ACK] Seq=1 Ack=1 Win=29312 Len=0 TSval=3952633 TSecr=84692105,255,
Packet: 10.0.10.88,200.132.35.220,80,TCP,66,47892 > 80 [FIN, ACK] Seq=1 Ack=1 Win=29312 Len=0 TSval=3952633 TSecr=84692105,256,
Packet: 10.0.10.88,200.132.35.220,80,TCP,66,47888 > 80 [FIN, ACK] Seq=837 Ack=833 Win=31360 Len=0 TSval=3952633 TSecr=84694141,257,
Packet: 10.0.10.88,200.132.35.220,80,TCP,74,47902 > 80 [SYN] Seq=0 Win=29200 Len=0 MSS=1460 SACK_PERM=1 TSval=3952633 TSecr=0 WS=128,258,
Packet: 10.0.10.88,200.132.35.220,80,TCP,66,47890 > 80 [ACK] Seq=2 Ack=2 Win=29312 Len=0 TSval=3952633 TSecr=84695446,260,259
Packet: 10.0.10.88,200.132.35.220,80,TCP,66,47892 > 80 [ACK] Seq=2 Ack=2 Win=29312 Len=0 TSval=3952633 TSecr=84695446,262,261
Packet: 10.0.10.88,200.132.35.220,80,TCP,66,47902 > 80 [ACK] Seq=1 Ack=1 Win=29312 Len=0 TSval=3952633 TSecr=84695446,265,264
Packet: 10.0.10.88,172.217.29.206,80,TCP,66,54258 > 80 [ACK] Seq=1 Ack=1 Win=237 Len=0 TSval=3952640 TSecr=1422128808,268,
Packet: 10.0.10.88,172.217.29.206,80,TCP,66,54262 > 80 [ACK] Seq=1 Ack=1 Win=229 Len=0 TSval=3952640 TSecr=1701401959,269,
Packet: 10.0.10.88,200.132.35.220,80,TCP,66,47902 > 80 [ACK] Seq=585 Ack=231 Win=30336 Len=0 TSval=3952662 TSecr=84695476,283,282
Packet: 10.0.10.88,200.132.35.220,80,TCP,74,47904 > 80 [SYN] Seq=0 Win=29200 Len=0 MSS=1460 SACK_PERM=1 TSval=3952667 TSecr=0 WS=128,289,
Packet: 10.0.10.88,200.132.35.220,80,TCP,74,47906 > 80 [SYN] Seq=0 Win=29200 Len=0 MSS=1460 SACK_PERM=1 TSval=3952668 TSecr=0 WS=128,291,
Packet: 10.0.10.88,200.132.35.220,80,TCP,66,47904 > 80 [ACK] Seq=1 Ack=1 Win=29312 Len=0 TSval=3952668 TSecr=84695481,292,290
Packet: 10.0.10.88,200.132.35.220,80,TCP,74,47908 > 80 [SYN] Seq=0 Win=29200 Len=0 MSS=1460 SACK_PERM=1 TSval=3952668 TSecr=0 WS=128,293,
Packet: 10.0.10.88,200.132.35.220,80,TCP,74,47910 > 80 [SYN] Seq=0 Win=29200 Len=0 MSS=1460 SACK_PERM=1 TSval=3952668 TSecr=0 WS=128,294,
Packet: 10.0.10.88,200.132.35.220,80,TCP,74,47912 > 80 [SYN] Seq=0 Win=29200 Len=0 MSS=1460 SACK_PERM=1 TSval=3952668 TSecr=0 WS=128,295,
Packet: 10.0.10.88,200.132.35.220,80,TCP,66,47906 > 80 [ACK] Seq=1 Ack=1 Win=29312 Len=0 TSval=3952668 TSecr=84695482,299,298
Packet: 10.0.10.88,200.132.35.220,80,TCP,66,47908 > 80 [ACK] Seq=1 Ack=1 Win=29312 Len=0 TSval=3952668 TSecr=84695482,302,301
Packet: 10.0.10.88,200.132.35.220,80,TCP,66,47910 > 80 [ACK] Seq=1 Ack=1 Win=29312 Len=0 TSval=3952670 TSecr=84695482,305,304
Packet: 10.0.10.88,200.132.35.220,80,TCP,66,47912 > 80 [ACK] Seq=1 Ack=1 Win=29312 Len=0 TSval=3952670 TSecr=84695482,307,306
Packet: 10.0.10.88,200.132.35.220,80,TCP,66,47904 > 80 [ACK] Seq=375 Ack=834 Win=30976 Len=0 TSval=3952670 TSecr=84695482,311,310
Packet: 10.0.10.88,200.132.35.220,80,TCP,66,47906 > 80 [ACK] Seq=385 Ack=1023 Win=31360 Len=0 TSval=3952670 TSecr=84695483,314,313
Packet: 10.0.10.88,200.132.35.220,80,TCP,66,47908 > 80 [ACK] Seq=382 Ack=981 Win=31232 Len=0 TSval=3952670 TSecr=84695483,317,316
Packet: 10.0.10.88,200.132.35.220,80,TCP,66,47910 > 80 [ACK] Seq=393 Ack=1105 Win=31488 Len=0 TSval=3952671 TSecr=84695485,321,320
Packet: 10.0.10.88,200.132.35.220,80,TCP,66,47902 > 80 [ACK] Seq=1806 Ack=2382 Win=34816 Len=0 TSval=3952681 TSecr=84695482,322,308
Packet: 10.0.10.88,200.132.35.220,80,TCP,66,47910 > 80 [ACK] Seq=785 Ack=1520 Win=33664 Len=0 TSval=3953382 TSecr=84696195,386,385
Packet: 10.0.10.88,200.132.35.220,80,TCP,66,47906 > 80 [ACK] Seq=385 Ack=1024 Win=31360 Len=0 TSval=3953931 TSecr=84696734,428,427

