"10.0.10.97","239.255.255.250","1900","SSDP","216","M-SEARCH * HTTP/1.1 ","1",""
"Palladiu_3d:da:1a","Broadcast","","ARP","42","Who has 10.0.10.1?  Tell 10.0.10.58","2",""
"10.0.10.52","10.0.10.255","57621","UDP","86","Source port: 57621  Destination port: 57621","3",""
"10.0.10.88","172.217.29.202","443","TCP","66","38834 > 443 [ACK] Seq=1 Ack=1 Win=385 Len=0 TSval=3949056 TSecr=1377411550","4",""
"172.217.29.202","10.0.10.88","38834","TCP","66","[TCP ACKed unseen segment] 443 > 38834 [ACK] Seq=1 Ack=2 Win=175 Len=0 TSval=1377456600 TSecr=3892291","5",""
"10.0.10.88","172.217.29.195","443","TLSv1.2","303","Application Data","6",""
"10.0.10.88","172.217.29.195","443","TLSv1.2","112","Application Data","7",""
"10.0.10.88","172.217.29.195","443","TLSv1.2","262","Application Data","8",""
"10.0.10.97","255.255.255.255","50049","UDP","72","Source port: 50050  Destination port: 50049","9",""
"10.0.10.97","239.255.255.250","1900","SSDP","216","M-SEARCH * HTTP/1.1 ","10",""
"172.217.29.195","10.0.10.88","38228","TCP","66","443 > 38228 [ACK] Seq=1 Ack=238 Win=448 Len=0 TSval=3717487926 TSecr=3949087","11","6"
"172.217.29.195","10.0.10.88","38228","TCP","66","443 > 38228 [ACK] Seq=1 Ack=284 Win=448 Len=0 TSval=3717487926 TSecr=3949087","12","7"
"172.217.29.195","10.0.10.88","38228","TLSv1.2","112","Application Data","13",""
"172.217.29.195","10.0.10.88","38228","TCP","66","443 > 38228 [ACK] Seq=47 Ack=480 Win=455 Len=0 TSval=3717487967 TSecr=3949088","14","8"
"10.0.10.88","172.217.29.195","443","TCP","66","38228 > 443 [ACK] Seq=480 Ack=47 Win=1670 Len=0 TSval=3949109 TSecr=3717487926","15","13"
"172.217.29.195","10.0.10.88","38228","TLSv1.2","140","Application Data","16",""
"172.217.29.195","10.0.10.88","38228","TLSv1.2","197","Application Data","17",""
"172.217.29.195","10.0.10.88","38228","TLSv1.2","104","Application Data","18",""
"172.217.29.195","10.0.10.88","38228","TLSv1.2","112","Application Data","19",""
"172.217.29.195","10.0.10.88","38228","TLSv1.2","117","Application Data","20",""
"172.217.29.195","10.0.10.88","38228","TLSv1.2","213","Application Data","21",""
"10.0.10.88","172.217.29.195","443","TCP","66","38228 > 443 [ACK] Seq=480 Ack=336 Win=1670 Len=0 TSval=3949122 TSecr=3717488000","22","19"
"172.217.29.195","10.0.10.88","38228","TLSv1.2","104","Application Data","23",""
"10.0.10.88","172.217.29.195","443","TCP","66","38228 > 443 [ACK] Seq=480 Ack=572 Win=1670 Len=0 TSval=3949122 TSecr=3717488001","24","23"
"10.0.10.88","172.217.29.195","443","TLSv1.2","112","Application Data","25",""
"172.217.29.195","10.0.10.88","38228","TCP","66","443 > 38228 [ACK] Seq=572 Ack=526 Win=455 Len=0 TSval=3717488068 TSecr=3949123","26","25"
"10.0.10.88","200.132.35.220","80","TCP","66","47870 > 80 [FIN, ACK] Seq=1 Ack=1 Win=229 Len=0 TSval=3949291 TSecr=84685976","27",""
"10.0.10.88","200.132.35.220","80","TCP","66","47872 > 80 [FIN, ACK] Seq=1 Ack=1 Win=229 Len=0 TSval=3949291 TSecr=84685976","28",""
"10.0.10.88","200.132.35.220","80","TCP","66","47868 > 80 [FIN, ACK] Seq=1 Ack=1 Win=237 Len=0 TSval=3949291 TSecr=84687229","29",""
"10.0.10.88","200.132.39.118","80","TCP","66","44526 > 80 [FIN, ACK] Seq=1 Ack=1 Win=229 Len=0 TSval=3949291 TSecr=1688290318","30",""
"10.0.10.88","200.132.39.118","80","TCP","66","44528 > 80 [FIN, ACK] Seq=1 Ack=1 Win=229 Len=0 TSval=3949291 TSecr=1688290318","31",""
"10.0.10.88","200.132.35.220","80","TCP","74","47888 > 80 [SYN] Seq=0 Win=29200 Len=0 MSS=1460 SACK_PERM=1 TSval=3949291 TSecr=0 WS=128","32",""
"10.0.10.88","200.132.35.220","80","TCP","74","47890 > 80 [SYN] Seq=0 Win=29200 Len=0 MSS=1460 SACK_PERM=1 TSval=3949291 TSecr=0 WS=128","33",""
"10.0.10.88","200.132.35.220","80","TCP","74","47892 > 80 [SYN] Seq=0 Win=29200 Len=0 MSS=1460 SACK_PERM=1 TSval=3949291 TSecr=0 WS=128","34",""
"200.132.35.220","10.0.10.88","47870","TCP","66","80 > 47870 [FIN, ACK] Seq=1 Ack=2 Win=227 Len=0 TSval=84692104 TSecr=3949291","35","27"
"10.0.10.88","200.132.35.220","80","TCP","66","47870 > 80 [ACK] Seq=2 Ack=2 Win=229 Len=0 TSval=3949291 TSecr=84692104","36","35"
"200.132.35.220","10.0.10.88","47872","TCP","66","80 > 47872 [FIN, ACK] Seq=1 Ack=2 Win=227 Len=0 TSval=84692104 TSecr=3949291","37","28"
"10.0.10.88","200.132.35.220","80","TCP","66","47872 > 80 [ACK] Seq=2 Ack=2 Win=229 Len=0 TSval=3949291 TSecr=84692104","38","37"
"200.132.35.220","10.0.10.88","47868","TCP","66","80 > 47868 [ACK] Seq=1 Ack=2 Win=235 Len=0 TSval=84692104 TSecr=3949291","39","29"
"200.132.35.220","10.0.10.88","47888","TCP","74","80 > 47888 [SYN, ACK] Seq=0 Ack=1 Win=28960 Len=0 MSS=1460 SACK_PERM=1 TSval=84692105 TSecr=3949291 WS=128","40","32"
"10.0.10.88","200.132.35.220","80","TCP","66","47888 > 80 [ACK] Seq=1 Ack=1 Win=29312 Len=0 TSval=3949291 TSecr=84692105","41","40"
"10.0.10.88","200.132.35.220","80","HTTP","484","GET /docencia1/ HTTP/1.1 ","42",""
"200.132.35.220","10.0.10.88","47890","TCP","74","80 > 47890 [SYN, ACK] Seq=0 Ack=1 Win=28960 Len=0 MSS=1460 SACK_PERM=1 TSval=84692105 TSecr=3949291 WS=128","43","33"
"10.0.10.88","200.132.35.220","80","TCP","66","47890 > 80 [ACK] Seq=1 Ack=1 Win=29312 Len=0 TSval=3949292 TSecr=84692105","44","43"
"200.132.35.220","10.0.10.88","47892","TCP","74","80 > 47892 [SYN, ACK] Seq=0 Ack=1 Win=28960 Len=0 MSS=1460 SACK_PERM=1 TSval=84692105 TSecr=3949291 WS=128","45","34"
"10.0.10.88","200.132.35.220","80","TCP","66","47892 > 80 [ACK] Seq=1 Ack=1 Win=29312 Len=0 TSval=3949292 TSecr=84692105","46","45"
"200.132.39.118","10.0.10.88","44528","TCP","66","80 > 44528 [ACK] Seq=1 Ack=2 Win=227 Len=0 TSval=1688292403 TSecr=3949291","47","31"
"200.132.39.118","10.0.10.88","44526","TCP","66","80 > 44526 [ACK] Seq=1 Ack=2 Win=227 Len=0 TSval=1688292403 TSecr=3949291","48","30"
"200.132.35.220","10.0.10.88","47888","TCP","66","80 > 47888 [ACK] Seq=1 Ack=419 Win=30080 Len=0 TSval=84692105 TSecr=3949291","49","42"
"200.132.35.220","10.0.10.88","47888","HTTP","482","HTTP/1.1 200 OK  (text/html)","50",""
"10.0.10.88","200.132.35.220","80","TCP","66","47888 > 80 [ACK] Seq=419 Ack=417 Win=30336 Len=0 TSval=3949292 TSecr=84692106","51","50"
"10.0.10.88","172.217.29.205","443","TCP","66","44058 > 443 [ACK] Seq=1 Ack=1 Win=407 Len=0 TSval=3949570 TSecr=3650106392","52",""
"10.0.10.88","216.58.202.138","443","TCP","66","47086 > 443 [ACK] Seq=1 Ack=1 Win=540 Len=0 TSval=3949573 TSecr=4016939135","53",""
"172.217.29.205","10.0.10.88","44058","TCP","66","[TCP ACKed unseen segment] 443 > 44058 [ACK] Seq=1 Ack=2 Win=175 Len=0 TSval=3650151440 TSecr=3893223","54",""
"216.58.202.138","10.0.10.88","47086","TCP","66","[TCP ACKed unseen segment] 443 > 47086 [ACK] Seq=1 Ack=2 Win=213 Len=0 TSval=4016984181 TSecr=3893105","55",""
"10.0.10.88","172.217.29.205","443","TCP","66","44032 > 443 [ACK] Seq=1 Ack=1 Win=451 Len=0 TSval=3949590 TSecr=528251876","56",""
"10.0.10.88","216.58.202.138","443","TCP","66","47094 > 443 [ACK] Seq=1 Ack=1 Win=473 Len=0 TSval=3949591 TSecr=3649295903","57",""
"172.217.29.205","10.0.10.88","44032","TCP","66","[TCP ACKed unseen segment] 443 > 44032 [ACK] Seq=1 Ack=2 Win=207 Len=0 TSval=528296922 TSecr=3893088","58",""
"216.58.202.138","10.0.10.88","47094","TCP","66","[TCP ACKed unseen segment] 443 > 47094 [ACK] Seq=1 Ack=2 Win=183 Len=0 TSval=3649340953 TSecr=3893136","59",""
"10.0.10.97","239.255.255.250","1900","SSDP","216","M-SEARCH * HTTP/1.1 ","60",""
"10.0.10.88","172.217.29.195","443","TLSv1.2","303","Application Data","61",""
"10.0.10.88","172.217.29.195","443","TLSv1.2","262","Application Data","62",""
"172.217.29.195","10.0.10.88","38228","TCP","66","443 > 38228 [ACK] Seq=572 Ack=763 Win=462 Len=0 TSval=3717491399 TSecr=3949956","63","61"
"172.217.29.195","10.0.10.88","38228","TCP","66","443 > 38228 [ACK] Seq=572 Ack=959 Win=469 Len=0 TSval=3717491399 TSecr=3949956","64","62"
"10.0.10.88","10.0.10.1","53","DNS","70","Standard query 0x2702  A google.com","65",""
"10.0.10.88","10.0.10.1","53","DNS","70","Standard query 0xe571  AAAA google.com","66",""
"10.0.10.1","10.0.10.88","33108","DNS","86","Standard query response 0x2702  A 172.217.29.206","67",""
"10.0.10.1","10.0.10.88","33108","DNS","98","Standard query response 0xe571  AAAA 2800:3f0:4001:807::200e","68",""
"10.0.10.88","172.217.29.206","80","TCP","74","54580 > 80 [SYN] Seq=0 Win=29200 Len=0 MSS=1460 SACK_PERM=1 TSval=3949972 TSecr=0 WS=128","69",""
"172.217.29.206","10.0.10.88","54580","TCP","74","80 > 54580 [SYN, ACK] Seq=0 Ack=1 Win=42408 Len=0 MSS=1380 SACK_PERM=1 TSval=4182261346 TSecr=3949972 WS=256","70","69"
"10.0.10.88","172.217.29.206","80","TCP","66","54580 > 80 [ACK] Seq=1 Ack=1 Win=29312 Len=0 TSval=3949982 TSecr=4182261346","71","70"
"10.0.10.88","172.217.29.206","80","HTTP","179","GET / HTTP/1.1 ","72",""
"172.217.29.195","10.0.10.88","38228","TLSv1.2","140","Application Data","73",""
"172.217.29.195","10.0.10.88","38228","TLSv1.2","197","Application Data","74",""
"172.217.29.195","10.0.10.88","38228","TLSv1.2","104","Application Data","75",""
"10.0.10.88","172.217.29.195","443","TCP","66","38228 > 443 [ACK] Seq=959 Ack=815 Win=1670 Len=0 TSval=3949984 TSecr=3717491470","76","75"
"172.217.29.195","10.0.10.88","38228","TLSv1.2","112","Application Data","77",""
"10.0.10.88","172.217.29.195","443","TLSv1.2","112","Application Data","78","77"
"172.217.29.206","10.0.10.88","54580","TCP","66","80 > 54580 [ACK] Seq=1 Ack=114 Win=42496 Len=0 TSval=4182261389 TSecr=3949982","79","72"
"172.217.29.195","10.0.10.88","38228","TCP","66","443 > 38228 [ACK] Seq=861 Ack=1005 Win=469 Len=0 TSval=3717491514 TSecr=3949985","80","78"
"172.217.29.195","10.0.10.88","38228","TLSv1.2","213","Application Data","81",""
"172.217.29.195","10.0.10.88","38228","TLSv1.2","117","Application Data","82",""
"10.0.10.88","172.217.29.195","443","TCP","66","38228 > 443 [ACK] Seq=1005 Ack=1059 Win=1670 Len=0 TSval=3950011 TSecr=3717491571","83","82"
"172.217.29.195","10.0.10.88","38228","TLSv1.2","112","[TCP Previous segment not captured] Application Data","84",""
"10.0.10.88","172.217.29.195","443","TCP","78","[TCP Dup ACK 83#1] 38228 > 443 [ACK] Seq=1005 Ack=1059 Win=1670 Len=0 TSval=3950011 TSecr=3717491571 SLE=1097 SRE=1143","85",""
"172.217.29.195","10.0.10.88","38228","TLSv1.2","104","[TCP Retransmission] Application Data","86",""
"10.0.10.88","172.217.29.195","443","TCP","66","38228 > 443 [ACK] Seq=1005 Ack=1143 Win=1670 Len=0 TSval=3950026 TSecr=3717491635","87","84"
"10.0.10.88","172.217.29.195","443","TLSv1.2","112","Application Data","88",""
"172.217.29.206","10.0.10.88","54580","TCP","66","[TCP Previous segment not captured] 80 > 54580 [FIN, ACK] Seq=917 Ack=114 Win=42496 Len=0 TSval=4182261549 TSecr=3949982","89",""
"10.0.10.88","172.217.29.206","80","TCP","78","[TCP Dup ACK 72#1] 54580 > 80 [ACK] Seq=114 Ack=1 Win=29312 Len=0 TSval=3950034 TSecr=4182261389 SLE=917 SRE=918","90",""
"172.217.29.206","10.0.10.88","54580","HTTP","982","[TCP Out-Of-Order] HTTP/1.1 302 Found  (text/html)","91",""
"10.0.10.88","172.217.29.206","80","TCP","66","54580 > 80 [ACK] Seq=114 Ack=918 Win=31104 Len=0 TSval=3950034 TSecr=4182261549","92","89"
"10.0.10.88","172.217.29.206","80","TCP","66","54580 > 80 [FIN, ACK] Seq=114 Ack=918 Win=31104 Len=0 TSval=3950034 TSecr=4182261549","93",""
"10.0.10.88","10.0.10.1","53","DNS","77","Standard query 0x11a4  A www.google.com.br","94",""
"10.0.10.88","10.0.10.1","53","DNS","77","Standard query 0xc6ff  AAAA www.google.com.br","95",""
"10.0.10.1","10.0.10.88","43875","DNS","93","Standard query response 0x11a4  A 172.217.29.195","96",""
"10.0.10.1","10.0.10.88","43875","DNS","105","Standard query response 0xc6ff  AAAA 2800:3f0:4001:807::2003","97",""
"172.217.29.195","10.0.10.88","38228","TCP","66","443 > 38228 [ACK] Seq=1143 Ack=1051 Win=469 Len=0 TSval=3717491682 TSecr=3950026","98","88"
"10.0.10.88","172.217.29.195","80","TCP","74","43016 > 80 [SYN] Seq=0 Win=29200 Len=0 MSS=1460 SACK_PERM=1 TSval=3950038 TSecr=0 WS=128","99",""
"172.217.29.206","10.0.10.88","54580","TCP","66","80 > 54580 [ACK] Seq=918 Ack=115 Win=42496 Len=0 TSval=4182261596 TSecr=3950034","100","93"
"172.217.29.195","10.0.10.88","43016","TCP","74","80 > 43016 [SYN, ACK] Seq=0 Ack=1 Win=42408 Len=0 MSS=1380 SACK_PERM=1 TSval=253448151 TSecr=3950038 WS=256","101","99"
"10.0.10.88","172.217.29.195","80","TCP","66","43016 > 80 [ACK] Seq=1 Ack=1 Win=29312 Len=0 TSval=3950054 TSecr=253448151","102","101"
"10.0.10.88","172.217.29.195","80","HTTP","222","GET /?gws_rd=cr&ei=1B6TWZ-_B8OdwgSB1ojIAw HTTP/1.1 ","103",""
"172.217.29.195","10.0.10.88","43016","TCP","66","80 > 43016 [ACK] Seq=1 Ack=157 Win=43520 Len=0 TSval=253448218 TSecr=3950054","104","103"
"10.0.10.88","200.132.35.220","80","HTTP","484","GET /docencia1/ HTTP/1.1 ","105",""
"200.132.35.220","10.0.10.88","47888","HTTP","481","HTTP/1.1 200 OK  (text/html)","106","105"
"10.0.10.88","200.132.35.220","80","TCP","66","47888 > 80 [ACK] Seq=837 Ack=832 Win=31360 Len=0 TSval=3950076 TSecr=84692890","107","106"
"172.217.29.195","10.0.10.88","43016","TCP","1484","[TCP segment of a reassembled PDU]","108",""
"10.0.10.88","172.217.29.195","80","TCP","66","43016 > 80 [ACK] Seq=157 Ack=1419 Win=32128 Len=0 TSval=3950111 TSecr=253448399","109","108"
"172.217.29.195","10.0.10.88","43016","TCP","1484","[TCP segment of a reassembled PDU]","110",""
"10.0.10.88","172.217.29.195","80","TCP","66","43016 > 80 [ACK] Seq=157 Ack=2837 Win=35072 Len=0 TSval=3950111 TSecr=253448399","111","110"
"172.217.29.195","10.0.10.88","43016","TCP","1484","[TCP segment of a reassembled PDU]","112",""
"10.0.10.88","172.217.29.195","80","TCP","66","43016 > 80 [ACK] Seq=157 Ack=4255 Win=37888 Len=0 TSval=3950111 TSecr=253448399","113","112"
"172.217.29.195","10.0.10.88","43016","TCP","1484","[TCP segment of a reassembled PDU]","114",""
"10.0.10.88","172.217.29.195","80","TCP","66","43016 > 80 [ACK] Seq=157 Ack=5673 Win=40832 Len=0 TSval=3950111 TSecr=253448399","115","114"
"10.0.10.88","172.217.29.195","80","TCP","66","43016 > 80 [RST, ACK] Seq=157 Ack=5673 Win=40832 Len=0 TSval=3950111 TSecr=253448399","116",""
"172.217.29.195","10.0.10.88","43016","TCP","1484","[TCP segment of a reassembled PDU]","117",""
"10.0.10.88","172.217.29.195","80","TCP","54","43016 > 80 [RST] Seq=157 Win=0 Len=0","118",""
"172.217.29.195","10.0.10.88","43016","TCP","1484","[TCP segment of a reassembled PDU]","119",""
"10.0.10.88","172.217.29.195","80","TCP","54","43016 > 80 [RST] Seq=157 Win=0 Len=0","120",""
"172.217.29.195","10.0.10.88","43016","TCP","1484","[TCP segment of a reassembled PDU]","121",""
"10.0.10.88","172.217.29.195","80","TCP","54","43016 > 80 [RST] Seq=157 Win=0 Len=0","122",""
"172.217.29.195","10.0.10.88","43016","TCP","1484","[TCP segment of a reassembled PDU]","123",""
"10.0.10.88","172.217.29.195","80","TCP","54","43016 > 80 [RST] Seq=157 Win=0 Len=0","124",""
"172.217.29.195","10.0.10.88","43016","TCP","261","[TCP segment of a reassembled PDU]","125",""
"10.0.10.88","172.217.29.195","80","TCP","54","43016 > 80 [RST] Seq=157 Win=0 Len=0","126",""
"172.217.29.195","10.0.10.88","43016","HTTP","66","HTTP/1.1 200 OK  (text/html)","127",""
"10.0.10.88","172.217.29.195","80","TCP","54","43016 > 80 [RST] Seq=157 Win=0 Len=0","128",""
"10.0.10.88","172.217.29.193","443","TCP","66","57332 > 443 [ACK] Seq=1 Ack=1 Win=341 Len=0 TSval=3950592 TSecr=731586291","129",""
"10.0.10.88","172.217.29.197","443","TCP","66","38842 > 443 [ACK] Seq=1 Ack=1 Win=1949 Len=0 TSval=3950592 TSecr=842670511","130",""
"172.217.29.193","10.0.10.88","57332","TCP","66","[TCP ACKed unseen segment] 443 > 57332 [ACK] Seq=1 Ack=2 Win=179 Len=0 TSval=731631349 TSecr=3893850","131",""
"172.217.29.197","10.0.10.88","38842","TCP","66","[TCP ACKed unseen segment] 443 > 38842 [ACK] Seq=1 Ack=2 Win=232 Len=0 TSval=842760624 TSecr=3894027","132",""
"Palladiu_3d:da:1a","Broadcast","","ARP","42","Who has 10.0.10.1?  Tell 10.0.10.58","133",""
"10.0.10.97","224.0.0.251","5353","MDNS","182","Standard query 0x0000  PTR _sleep-proxy._udp.local, ""QM"" question PTR _airport._tcp.local, ""QM"" question PTR _pdl-datastream._tcp.local, ""QM"" question PTR _printer._tcp.local, ""QM"" question PTR _afpovertcp._tcp.local, ""QM"" question PTR _rfb._tcp.local, ""QM"" question PTR _adisk._tcp.local, ""QM"" question","134",""
"fe80::1c5c:97e4:3016:1ed2","ff02::fb","5353","MDNS","202","Standard query 0x0000  PTR _sleep-proxy._udp.local, ""QM"" question PTR _airport._tcp.local, ""QM"" question PTR _pdl-datastream._tcp.local, ""QM"" question PTR _printer._tcp.local, ""QM"" question PTR _afpovertcp._tcp.local, ""QM"" question PTR _rfb._tcp.local, ""QM"" question PTR _adisk._tcp.local, ""QM"" question","135",""
"10.0.10.97","224.0.0.251","5353","MDNS","298","Standard query response 0x0000  TXT PTR Gio\\342\\200\\231s Mac Pro._rfb._tcp.local","136",""
"fe80::1c5c:97e4:3016:1ed2","ff02::fb","5353","MDNS","318","Standard query response 0x0000  TXT PTR Gio\\342\\200\\231s Mac Pro._rfb._tcp.local","137",""
"10.0.10.1","224.0.0.251","5353","MDNS","820","Standard query response 0x0000  PTR 30-34-10-70.1 glpbd._sleep-proxy._udp.local PTR glpbd._airport._tcp.local TXT PTR glpbd._afpovertcp._tcp.local PTR glpbd._adisk._tcp.local","138",""
"fe80::9284:dff:fee8:7aa2","ff02::fb","5353","MDNS","840","Standard query response 0x0000  PTR 30-34-10-70.1 glpbd._sleep-proxy._udp.local PTR glpbd._airport._tcp.local TXT PTR glpbd._afpovertcp._tcp.local PTR glpbd._adisk._tcp.local","139",""
"10.0.10.53","224.0.0.251","5353","MDNS","213","Standard query response 0x0000  PTR HP Color LaserJet CP1515n (C28BBE)._pdl-datastream._tcp.local PTR HP Color LaserJet CP1515n (C28BBE)._printer._tcp.local","140",""
"fe80::1ec1:deff:fec2:8bbe","ff02::fb","5353","MDNS","634","Standard query response 0x0000  PTR HP Color LaserJet CP1515n (C28BBE)._pdl-datastream._tcp.local PTR HP Color LaserJet CP1515n (C28BBE)._printer._tcp.local","141",""
"10.0.10.88","172.217.29.206","443","TCP","66","44628 > 443 [ACK] Seq=1 Ack=1 Win=385 Len=0 TSval=3951104 TSecr=579273517","142",""
"10.0.10.88","172.217.29.202","443","TCP","66","38946 > 443 [ACK] Seq=1 Ack=1 Win=407 Len=0 TSval=3951104 TSecr=1505344866","143",""
"10.0.10.88","172.217.29.195","443","TCP","66","38274 > 443 [ACK] Seq=1 Ack=1 Win=1427 Len=0 TSval=3951104 TSecr=437049160","144",""
"10.0.10.88","172.217.29.206","443","TCP","66","44602 > 443 [ACK] Seq=1 Ack=1 Win=452 Len=0 TSval=3951104 TSecr=1422122663","145",""
"10.0.10.88","172.217.29.206","443","TLSv1.2","396","Application Data","146",""
"10.0.10.88","172.217.29.206","443","TLSv1.2","383","Application Data, Application Data","147",""
"172.217.29.206","10.0.10.88","44628","TCP","66","[TCP ACKed unseen segment] 443 > 44628 [ACK] Seq=1 Ack=2 Win=196 Len=0 TSval=579318578 TSecr=3894506","148",""
"172.217.29.202","10.0.10.88","38946","TCP","66","[TCP ACKed unseen segment] 443 > 38946 [ACK] Seq=1 Ack=2 Win=184 Len=0 TSval=1505391539 TSecr=3939424","149",""
"172.217.29.206","10.0.10.88","44602","TCP","66","[TCP ACKed unseen segment] 443 > 44602 [ACK] Seq=1 Ack=2 Win=207 Len=0 TSval=1422167725 TSecr=3894455","150",""
"172.217.29.195","10.0.10.88","38274","TCP","66","[TCP ACKed unseen segment] 443 > 38274 [ACK] Seq=1 Ack=2 Win=179 Len=0 TSval=437094224 TSecr=3894681","151",""
"172.217.29.206","10.0.10.88","44582","TCP","66","443 > 44582 [ACK] Seq=1 Ack=331 Win=523 Len=0 TSval=2028174414 TSecr=3951107","152","146"
"172.217.29.206","10.0.10.88","44582","TCP","66","443 > 44582 [ACK] Seq=1 Ack=648 Win=534 Len=0 TSval=2028174414 TSecr=3951108","153","147"
"172.217.29.206","10.0.10.88","44582","TLSv1.2","112","Application Data","154",""
"10.0.10.88","172.217.29.206","443","TCP","66","44582 > 443 [ACK] Seq=648 Ack=47 Win=1187 Len=0 TSval=3951133 TSecr=2028174415","155","154"
"172.217.29.206","10.0.10.88","44582","TLSv1.2","131","Application Data","156",""
"10.0.10.88","172.217.29.206","443","TCP","66","44582 > 443 [ACK] Seq=648 Ack=112 Win=1187 Len=0 TSval=3951152 TSecr=2028174548","157","156"
"172.217.29.206","10.0.10.88","44582","TLSv1.2","112","Application Data","158",""
"10.0.10.88","172.217.29.206","443","TCP","66","44582 > 443 [ACK] Seq=648 Ack=158 Win=1187 Len=0 TSval=3951152 TSecr=2028174548","159","158"
"10.0.10.88","172.217.29.206","443","TLSv1.2","112","Application Data","160",""
"172.217.29.206","10.0.10.88","44582","TCP","66","443 > 44582 [ACK] Seq=158 Ack=694 Win=534 Len=0 TSval=2028174632 TSecr=3951152","161","160"
"64.233.186.188","10.0.10.88","39226","TLSv1.2","394","Application Data","162",""
"10.0.10.88","64.233.186.188","443","TCP","66","39226 > 443 [ACK] Seq=1 Ack=329 Win=363 Len=0 TSval=3951193 TSecr=2570866817","163","162"
"10.0.10.88","216.58.202.138","443","TLSv1.2","445","Application Data","164",""
"216.58.202.138","10.0.10.88","47272","TCP","66","443 > 47272 [ACK] Seq=1 Ack=380 Win=212 Len=0 TSval=3744795984 TSecr=3951237","165","164"
"216.58.202.138","10.0.10.88","47272","TLSv1.2","587","Application Data","166",""
"10.0.10.88","216.58.202.138","443","TCP","66","47272 > 443 [ACK] Seq=380 Ack=522 Win=1416 Len=0 TSval=3951308 TSecr=3744796223","167","166"
"216.58.202.138","10.0.10.88","47272","TLSv1.2","1484","Application Data","168",""
"10.0.10.88","216.58.202.138","443","TCP","66","47272 > 443 [ACK] Seq=380 Ack=1940 Win=1439 Len=0 TSval=3951308 TSecr=3744796223","169","168"
"216.58.202.138","10.0.10.88","47272","TLSv1.2","1484","Application Data","170",""
"10.0.10.88","216.58.202.138","443","TCP","66","47272 > 443 [ACK] Seq=380 Ack=3358 Win=1435 Len=0 TSval=3951309 TSecr=3744796223","171","170"
"216.58.202.138","10.0.10.88","47272","TLSv1.2","1484","Application Data","172",""
"10.0.10.88","216.58.202.138","443","TCP","66","47272 > 443 [ACK] Seq=380 Ack=4776 Win=1426 Len=0 TSval=3951309 TSecr=3744796223","173","172"
"216.58.202.138","10.0.10.88","47272","TLSv1.2","1124","Application Data","174",""
"10.0.10.88","216.58.202.138","443","TCP","66","47272 > 443 [ACK] Seq=380 Ack=5834 Win=1418 Len=0 TSval=3951309 TSecr=3744796223","175","174"
"216.58.202.138","10.0.10.88","47272","TLSv1.2","100","Application Data","176",""
"10.0.10.88","216.58.202.138","443","TCP","66","47272 > 443 [ACK] Seq=380 Ack=5868 Win=1418 Len=0 TSval=3951309 TSecr=3744796223","177","176"
"200.132.35.220","10.0.10.88","47888","TCP","66","80 > 47888 [FIN, ACK] Seq=832 Ack=837 Win=31104 Len=0 TSval=84694141 TSecr=3950076","178",""
"10.0.10.88","200.132.35.220","80","TCP","66","47888 > 80 [ACK] Seq=837 Ack=833 Win=31360 Len=0 TSval=3951339 TSecr=84694141","179","178"
"10.0.10.97","255.255.255.255","50049","UDP","72","Source port: 50050  Destination port: 50049","180",""
"10.0.10.88","255.255.255.255","17500","DB-LSP-DISC","259","Dropbox LAN sync Discovery Protocol","181",""
"10.0.10.88","10.0.10.255","17500","DB-LSP-DISC","259","Dropbox LAN sync Discovery Protocol","182",""
"10.0.10.88","239.255.255.250","1900","SSDP","214","M-SEARCH * HTTP/1.1 ","183",""
"10.0.10.88","172.217.29.206","443","TLSv1.2","194","Application Data","184",""
"10.0.10.88","172.217.29.206","443","TLSv1.2","1393","Application Data","185",""
"172.217.29.206","10.0.10.88","44582","TCP","66","443 > 44582 [ACK] Seq=158 Ack=822 Win=544 Len=0 TSval=2028178173 TSecr=3952047","186","184"
"172.217.29.206","10.0.10.88","44582","TLSv1.2","153","Application Data","187","185"
"172.217.29.206","10.0.10.88","44582","TLSv1.2","645","Application Data","188",""
"10.0.10.88","172.217.29.206","443","TCP","66","44582 > 443 [ACK] Seq=2149 Ack=824 Win=1210 Len=0 TSval=3952105 TSecr=2028178357","189","188"
"172.217.29.206","10.0.10.88","44582","TLSv1.2","309","Application Data","190",""
"172.217.29.206","10.0.10.88","44582","TLSv1.2","112","[TCP Previous segment not captured] Application Data","191",""
"10.0.10.88","172.217.29.206","443","TCP","78","44582 > 443 [ACK] Seq=2149 Ack=1067 Win=1232 Len=0 TSval=3952106 TSecr=2028178359 SLE=1212 SRE=1258","192","190"
"172.217.29.206","10.0.10.88","44582","TLSv1.2","211","[TCP Retransmission] Application Data","193",""
"10.0.10.88","172.217.29.206","443","TCP","66","44582 > 443 [ACK] Seq=2149 Ack=1258 Win=1254 Len=0 TSval=3952192 TSecr=2028178678","194","191"
"10.0.10.88","172.217.29.206","443","TLSv1.2","112","Application Data","195",""
"172.217.29.206","10.0.10.88","44582","TCP","66","443 > 44582 [ACK] Seq=1258 Ack=2195 Win=555 Len=0 TSval=2028178751 TSecr=3952192","196","195"
"172.217.29.202","10.0.10.88","38834","TLSv1.2","129","[TCP ACKed unseen segment] Application Data","197",""
"172.217.29.202","10.0.10.88","38834","TCP","66","[TCP ACKed unseen segment] 443 > 38834 [FIN, ACK] Seq=64 Ack=2 Win=175 Len=0 TSval=1377469495 TSecr=3892291","198",""
"10.0.10.88","172.217.29.202","443","TCP","66","[TCP Previous segment not captured] 38834 > 443 [FIN, ACK] Seq=2 Ack=65 Win=385 Len=0 TSval=3952291 TSecr=1377469495","199","198"
"10.0.10.88","239.255.255.250","1900","SSDP","214","M-SEARCH * HTTP/1.1 ","200",""
"172.217.29.202","10.0.10.88","38834","TCP","66","[TCP ACKed unseen segment] 443 > 38834 [ACK] Seq=65 Ack=3 Win=175 Len=0 TSval=1377469541 TSecr=3952291","201","199"
"10.0.10.121","255.255.255.255","17500","DB-LSP-DISC","445","Dropbox LAN sync Discovery Protocol","202",""
"10.0.10.121","255.255.255.255","17500","DB-LSP-DISC","445","Dropbox LAN sync Discovery Protocol","203",""
"10.0.10.121","10.0.10.255","17500","DB-LSP-DISC","445","Dropbox LAN sync Discovery Protocol","204",""
"10.0.10.121","255.255.255.255","17500","DB-LSP-DISC","445","Dropbox LAN sync Discovery Protocol","205",""
"10.0.10.121","255.255.255.255","17500","DB-LSP-DISC","445","Dropbox LAN sync Discovery Protocol","206",""
"10.0.10.121","255.255.255.255","17500","DB-LSP-DISC","445","Dropbox LAN sync Discovery Protocol","207",""
"10.0.10.121","239.255.255.250","1900","SSDP","215","M-SEARCH * HTTP/1.1 ","208",""
"10.0.10.88","10.0.10.1","53","DNS","70","Standard query 0xaf8a  A google.com","209",""
"10.0.10.88","10.0.10.1","53","DNS","70","Standard query 0xbc43  AAAA google.com","210",""
"10.0.10.1","10.0.10.88","41023","DNS","86","Standard query response 0xaf8a  A 172.217.29.206","211",""
"10.0.10.1","10.0.10.88","41023","DNS","98","Standard query response 0xbc43  AAAA 2800:3f0:4001:807::200e","212",""
"10.0.10.88","172.217.29.206","80","TCP","74","54584 > 80 [SYN] Seq=0 Win=29200 Len=0 MSS=1460 SACK_PERM=1 TSval=3952488 TSecr=0 WS=128","213",""
"172.217.29.206","10.0.10.88","54584","TCP","74","80 > 54584 [SYN, ACK] Seq=0 Ack=1 Win=42408 Len=0 MSS=1380 SACK_PERM=1 TSval=3642265827 TSecr=3952488 WS=256","214","213"
"10.0.10.88","172.217.29.206","80","TCP","66","54584 > 80 [ACK] Seq=1 Ack=1 Win=29312 Len=0 TSval=3952500 TSecr=3642265827","215","214"
"10.0.10.88","172.217.29.206","80","HTTP","179","GET / HTTP/1.1 ","216",""
"172.217.29.206","10.0.10.88","54584","TCP","66","80 > 54584 [ACK] Seq=1 Ack=114 Win=42496 Len=0 TSval=3642265873 TSecr=3952500","217","216"
"10.0.10.88","239.255.255.250","1900","SSDP","214","M-SEARCH * HTTP/1.1 ","218",""
"172.217.29.206","10.0.10.88","54584","TCP","66","[TCP Previous segment not captured] 80 > 54584 [FIN, ACK] Seq=917 Ack=114 Win=42496 Len=0 TSval=3642266035 TSecr=3952500","219",""
"10.0.10.88","172.217.29.206","80","TCP","78","[TCP Dup ACK 216#1] 54584 > 80 [ACK] Seq=114 Ack=1 Win=29312 Len=0 TSval=3952552 TSecr=3642265873 SLE=917 SRE=918","220",""
"172.217.29.206","10.0.10.88","54584","HTTP","982","[TCP Out-Of-Order] HTTP/1.1 302 Found  (text/html)","221",""
"10.0.10.88","172.217.29.206","80","TCP","66","54584 > 80 [ACK] Seq=114 Ack=918 Win=31104 Len=0 TSval=3952552 TSecr=3642266034","222","219"
"10.0.10.88","172.217.29.206","80","TCP","66","54584 > 80 [FIN, ACK] Seq=114 Ack=918 Win=31104 Len=0 TSval=3952552 TSecr=3642266034","223",""
"10.0.10.88","10.0.10.1","53","DNS","77","Standard query 0xa6f4  A www.google.com.br","224",""
"10.0.10.88","10.0.10.1","53","DNS","77","Standard query 0x19c5  AAAA www.google.com.br","225",""
"10.0.10.1","10.0.10.88","41647","DNS","93","Standard query response 0xa6f4  A 172.217.29.195","226",""
"10.0.10.1","10.0.10.88","41647","DNS","105","Standard query response 0x19c5  AAAA 2800:3f0:4001:807::2003","227",""
"10.0.10.88","172.217.29.195","80","TCP","74","43020 > 80 [SYN] Seq=0 Win=29200 Len=0 MSS=1460 SACK_PERM=1 TSval=3952554 TSecr=0 WS=128","228",""
"172.217.29.206","10.0.10.88","54584","TCP","66","80 > 54584 [ACK] Seq=918 Ack=115 Win=42496 Len=0 TSval=3642266082 TSecr=3952552","229","223"
"172.217.29.195","10.0.10.88","43020","TCP","74","80 > 43020 [SYN, ACK] Seq=0 Ack=1 Win=42408 Len=0 MSS=1380 SACK_PERM=1 TSval=3033994128 TSecr=3952554 WS=256","230","228"
"10.0.10.88","172.217.29.195","80","TCP","66","43020 > 80 [ACK] Seq=1 Ack=1 Win=29312 Len=0 TSval=3952565 TSecr=3033994128","231","230"
"10.0.10.88","172.217.29.195","80","HTTP","222","GET /?gws_rd=cr&ei=3h6TWb3oC8uQwgSS5JCwDA HTTP/1.1 ","232",""
"172.217.29.195","10.0.10.88","43020","TCP","66","80 > 43020 [ACK] Seq=1 Ack=157 Win=43520 Len=0 TSval=3033994174 TSecr=3952566","233","232"
"172.217.29.195","10.0.10.88","43020","TCP","1484","[TCP segment of a reassembled PDU]","234",""
"10.0.10.88","172.217.29.195","80","TCP","66","43020 > 80 [ACK] Seq=157 Ack=1419 Win=32128 Len=0 TSval=3952621 TSecr=3033994350","235","234"
"172.217.29.195","10.0.10.88","43020","TCP","1484","[TCP segment of a reassembled PDU]","236",""
"10.0.10.88","172.217.29.195","80","TCP","66","43020 > 80 [ACK] Seq=157 Ack=2837 Win=35072 Len=0 TSval=3952622 TSecr=3033994350","237","236"
"172.217.29.195","10.0.10.88","43020","TCP","1484","[TCP segment of a reassembled PDU]","238",""
"10.0.10.88","172.217.29.195","80","TCP","66","43020 > 80 [ACK] Seq=157 Ack=4255 Win=37888 Len=0 TSval=3952622 TSecr=3033994350","239","238"
"10.0.10.88","172.217.29.195","80","TCP","66","43020 > 80 [RST, ACK] Seq=157 Ack=4255 Win=37888 Len=0 TSval=3952622 TSecr=3033994350","240",""
"172.217.29.195","10.0.10.88","43020","TCP","1484","[TCP segment of a reassembled PDU]","241",""
"10.0.10.88","172.217.29.195","80","TCP","54","43020 > 80 [RST] Seq=157 Win=0 Len=0","242",""
"172.217.29.195","10.0.10.88","43020","TCP","1484","[TCP segment of a reassembled PDU]","243",""
"10.0.10.88","172.217.29.195","80","TCP","54","43020 > 80 [RST] Seq=157 Win=0 Len=0","244",""
"172.217.29.195","10.0.10.88","43020","TCP","1484","[TCP segment of a reassembled PDU]","245",""
"10.0.10.88","172.217.29.195","80","TCP","54","43020 > 80 [RST] Seq=157 Win=0 Len=0","246",""
"172.217.29.195","10.0.10.88","43020","TCP","1484","[TCP segment of a reassembled PDU]","247",""
"10.0.10.88","172.217.29.195","80","TCP","54","43020 > 80 [RST] Seq=157 Win=0 Len=0","248",""
"172.217.29.195","10.0.10.88","43020","TCP","1484","[TCP segment of a reassembled PDU]","249",""
"10.0.10.88","172.217.29.195","80","TCP","54","43020 > 80 [RST] Seq=157 Win=0 Len=0","250",""
"172.217.29.195","10.0.10.88","43020","TCP","357","[TCP segment of a reassembled PDU]","251",""
"10.0.10.88","172.217.29.195","80","TCP","54","43020 > 80 [RST] Seq=157 Win=0 Len=0","252",""
"172.217.29.195","10.0.10.88","43020","HTTP","66","HTTP/1.1 200 OK  (text/html)","253",""
"10.0.10.88","172.217.29.195","80","TCP","54","43020 > 80 [RST] Seq=157 Win=0 Len=0","254",""
"10.0.10.88","200.132.35.220","80","TCP","66","47890 > 80 [FIN, ACK] Seq=1 Ack=1 Win=29312 Len=0 TSval=3952633 TSecr=84692105","255",""
"10.0.10.88","200.132.35.220","80","TCP","66","47892 > 80 [FIN, ACK] Seq=1 Ack=1 Win=29312 Len=0 TSval=3952633 TSecr=84692105","256",""
"10.0.10.88","200.132.35.220","80","TCP","66","47888 > 80 [FIN, ACK] Seq=837 Ack=833 Win=31360 Len=0 TSval=3952633 TSecr=84694141","257",""
"10.0.10.88","200.132.35.220","80","TCP","74","47902 > 80 [SYN] Seq=0 Win=29200 Len=0 MSS=1460 SACK_PERM=1 TSval=3952633 TSecr=0 WS=128","258",""
"200.132.35.220","10.0.10.88","47890","TCP","66","80 > 47890 [FIN, ACK] Seq=1 Ack=2 Win=29056 Len=0 TSval=84695446 TSecr=3952633","259","255"
"10.0.10.88","200.132.35.220","80","TCP","66","47890 > 80 [ACK] Seq=2 Ack=2 Win=29312 Len=0 TSval=3952633 TSecr=84695446","260","259"
"200.132.35.220","10.0.10.88","47892","TCP","66","80 > 47892 [FIN, ACK] Seq=1 Ack=2 Win=29056 Len=0 TSval=84695446 TSecr=3952633","261","256"
"10.0.10.88","200.132.35.220","80","TCP","66","47892 > 80 [ACK] Seq=2 Ack=2 Win=29312 Len=0 TSval=3952633 TSecr=84695446","262","261"
"200.132.35.220","10.0.10.88","47888","TCP","66","80 > 47888 [ACK] Seq=833 Ack=838 Win=31104 Len=0 TSval=84695446 TSecr=3952633","263","257"
"200.132.35.220","10.0.10.88","47902","TCP","74","80 > 47902 [SYN, ACK] Seq=0 Ack=1 Win=28960 Len=0 MSS=1460 SACK_PERM=1 TSval=84695446 TSecr=3952633 WS=128","264","258"
"10.0.10.88","200.132.35.220","80","TCP","66","47902 > 80 [ACK] Seq=1 Ack=1 Win=29312 Len=0 TSval=3952633 TSecr=84695446","265","264"
"10.0.10.88","200.132.35.220","80","HTTP","650","POST /docencia1/grafico.php HTTP/1.1  (application/x-www-form-urlencoded)","266",""
"200.132.35.220","10.0.10.88","47902","TCP","66","80 > 47902 [ACK] Seq=1 Ack=585 Win=30208 Len=0 TSval=84695447 TSecr=3952633","267","266"
"10.0.10.88","172.217.29.206","80","TCP","66","54258 > 80 [ACK] Seq=1 Ack=1 Win=237 Len=0 TSval=3952640 TSecr=1422128808","268",""
"10.0.10.88","172.217.29.206","80","TCP","66","54262 > 80 [ACK] Seq=1 Ack=1 Win=229 Len=0 TSval=3952640 TSecr=1701401959","269",""
"10.0.10.88","172.217.29.206","443","TCP","66","44658 > 443 [ACK] Seq=1 Ack=1 Win=385 Len=0 TSval=3952640 TSecr=159013344","270",""
"10.0.10.88","172.217.29.196","443","TCP","66","55458 > 443 [ACK] Seq=1 Ack=1 Win=608 Len=0 TSval=3952640 TSecr=3182379274","271",""
"10.0.10.88","172.217.29.206","443","TCP","66","44670 > 443 [ACK] Seq=1 Ack=1 Win=408 Len=0 TSval=3952640 TSecr=1422128808","272",""
"10.0.10.88","172.217.29.206","443","TCP","66","44668 > 443 [ACK] Seq=1 Ack=1 Win=611 Len=0 TSval=3952640 TSecr=3308398718","273",""
"10.0.10.88","216.58.202.138","443","TCP","66","47168 > 443 [ACK] Seq=1 Ack=1 Win=340 Len=0 TSval=3952640 TSecr=3781096416","274",""
"172.217.29.206","10.0.10.88","54258","TCP","66","[TCP ACKed unseen segment] 80 > 54258 [ACK] Seq=1 Ack=2 Win=177 Len=0 TSval=1422173864 TSecr=3896202","275",""
"172.217.29.206","10.0.10.88","54262","TCP","66","[TCP ACKed unseen segment] 80 > 54262 [ACK] Seq=1 Ack=2 Win=177 Len=0 TSval=1701447016 TSecr=3896264","276",""
"172.217.29.206","10.0.10.88","44658","TCP","66","[TCP ACKed unseen segment] 443 > 44658 [ACK] Seq=1 Ack=2 Win=179 Len=0 TSval=159058401 TSecr=3895843","277",""
"172.217.29.206","10.0.10.88","44670","TCP","66","[TCP ACKed unseen segment] 443 > 44670 [ACK] Seq=1 Ack=2 Win=181 Len=0 TSval=1422173865 TSecr=3896101","278",""
"172.217.29.196","10.0.10.88","55458","TCP","66","[TCP ACKed unseen segment] 443 > 55458 [ACK] Seq=1 Ack=2 Win=222 Len=0 TSval=3182424330 TSecr=3896224","279",""
"172.217.29.206","10.0.10.88","44668","TCP","66","[TCP ACKed unseen segment] 443 > 44668 [ACK] Seq=1 Ack=2 Win=185 Len=0 TSval=3308443775 TSecr=3896179","280",""
"216.58.202.138","10.0.10.88","47168","TCP","66","[TCP ACKed unseen segment] 443 > 47168 [ACK] Seq=1 Ack=2 Win=179 Len=0 TSval=3781141474 TSecr=3896217","281",""
"200.132.35.220","10.0.10.88","47902","HTTP","296","HTTP/1.1 302 Found  (text/html)","282",""
"10.0.10.88","200.132.35.220","80","TCP","66","47902 > 80 [ACK] Seq=585 Ack=231 Win=30336 Len=0 TSval=3952662 TSecr=84695476","283","282"
"10.0.10.88","200.132.35.220","80","HTTP","535","GET /docencia1/html.php HTTP/1.1 ","284",""
"200.132.35.220","10.0.10.88","47902","TCP","66","80 > 47902 [ACK] Seq=231 Ack=1054 Win=31360 Len=0 TSval=84695477 TSecr=3952663","285","284"
"200.132.35.220","10.0.10.88","47902","HTTP","502","HTTP/1.1 200 OK  (text/html)","286",""
"10.0.10.88","200.132.35.220","80","HTTP","442","GET /docencia1/NRZ-L.png HTTP/1.1 ","287","286"
"200.132.35.220","10.0.10.88","47902","HTTP","928","HTTP/1.1 200 OK  (PNG)","288","287"
"10.0.10.88","200.132.35.220","80","TCP","74","47904 > 80 [SYN] Seq=0 Win=29200 Len=0 MSS=1460 SACK_PERM=1 TSval=3952667 TSecr=0 WS=128","289",""
"200.132.35.220","10.0.10.88","47904","TCP","74","80 > 47904 [SYN, ACK] Seq=0 Ack=1 Win=28960 Len=0 MSS=1460 SACK_PERM=1 TSval=84695481 TSecr=3952667 WS=128","290","289"
"10.0.10.88","200.132.35.220","80","TCP","74","47906 > 80 [SYN] Seq=0 Win=29200 Len=0 MSS=1460 SACK_PERM=1 TSval=3952668 TSecr=0 WS=128","291",""
"10.0.10.88","200.132.35.220","80","TCP","66","47904 > 80 [ACK] Seq=1 Ack=1 Win=29312 Len=0 TSval=3952668 TSecr=84695481","292","290"
"10.0.10.88","200.132.35.220","80","TCP","74","47908 > 80 [SYN] Seq=0 Win=29200 Len=0 MSS=1460 SACK_PERM=1 TSval=3952668 TSecr=0 WS=128","293",""
"10.0.10.88","200.132.35.220","80","TCP","74","47910 > 80 [SYN] Seq=0 Win=29200 Len=0 MSS=1460 SACK_PERM=1 TSval=3952668 TSecr=0 WS=128","294",""
"10.0.10.88","200.132.35.220","80","TCP","74","47912 > 80 [SYN] Seq=0 Win=29200 Len=0 MSS=1460 SACK_PERM=1 TSval=3952668 TSecr=0 WS=128","295",""
"10.0.10.88","200.132.35.220","80","HTTP","442","GET /docencia1/NRZ-I.png HTTP/1.1 ","296","288"
"10.0.10.88","200.132.35.220","80","HTTP","440","GET /docencia1/ami.png HTTP/1.1 ","297",""
"200.132.35.220","10.0.10.88","47906","TCP","74","80 > 47906 [SYN, ACK] Seq=0 Ack=1 Win=28960 Len=0 MSS=1460 SACK_PERM=1 TSval=84695482 TSecr=3952668 WS=128","298","291"
"10.0.10.88","200.132.35.220","80","TCP","66","47906 > 80 [ACK] Seq=1 Ack=1 Win=29312 Len=0 TSval=3952668 TSecr=84695482","299","298"
"10.0.10.88","200.132.35.220","80","HTTP","450","GET /docencia1/pseudoternary.png HTTP/1.1 ","300",""
"200.132.35.220","10.0.10.88","47908","TCP","74","80 > 47908 [SYN, ACK] Seq=0 Ack=1 Win=28960 Len=0 MSS=1460 SACK_PERM=1 TSval=84695482 TSecr=3952668 WS=128","301","293"
"10.0.10.88","200.132.35.220","80","TCP","66","47908 > 80 [ACK] Seq=1 Ack=1 Win=29312 Len=0 TSval=3952668 TSecr=84695482","302","301"
"10.0.10.88","200.132.35.220","80","HTTP","447","GET /docencia1/manchester.png HTTP/1.1 ","303",""
"200.132.35.220","10.0.10.88","47910","TCP","74","80 > 47910 [SYN, ACK] Seq=0 Ack=1 Win=28960 Len=0 MSS=1460 SACK_PERM=1 TSval=84695482 TSecr=3952668 WS=128","304","294"
"10.0.10.88","200.132.35.220","80","TCP","66","47910 > 80 [ACK] Seq=1 Ack=1 Win=29312 Len=0 TSval=3952670 TSecr=84695482","305","304"
"200.132.35.220","10.0.10.88","47912","TCP","74","80 > 47912 [SYN, ACK] Seq=0 Ack=1 Win=28960 Len=0 MSS=1460 SACK_PERM=1 TSval=84695482 TSecr=3952668 WS=128","306","295"
"10.0.10.88","200.132.35.220","80","TCP","66","47912 > 80 [ACK] Seq=1 Ack=1 Win=29312 Len=0 TSval=3952670 TSecr=84695482","307","306"
"200.132.35.220","10.0.10.88","47902","HTTP","919","HTTP/1.1 200 OK  (PNG)","308","296"
"200.132.35.220","10.0.10.88","47904","TCP","66","80 > 47904 [ACK] Seq=1 Ack=375 Win=30080 Len=0 TSval=84695482 TSecr=3952668","309","297"
"200.132.35.220","10.0.10.88","47904","HTTP","899","HTTP/1.1 200 OK  (PNG)","310",""
"10.0.10.88","200.132.35.220","80","TCP","66","47904 > 80 [ACK] Seq=375 Ack=834 Win=30976 Len=0 TSval=3952670 TSecr=84695482","311","310"
"200.132.35.220","10.0.10.88","47906","TCP","66","80 > 47906 [ACK] Seq=1 Ack=385 Win=30080 Len=0 TSval=84695483 TSecr=3952668","312","300"
"200.132.35.220","10.0.10.88","47906","HTTP","1088","HTTP/1.1 200 OK  (PNG)","313",""
"10.0.10.88","200.132.35.220","80","TCP","66","47906 > 80 [ACK] Seq=385 Ack=1023 Win=31360 Len=0 TSval=3952670 TSecr=84695483","314","313"
"200.132.35.220","10.0.10.88","47908","TCP","66","80 > 47908 [ACK] Seq=1 Ack=382 Win=30080 Len=0 TSval=84695483 TSecr=3952668","315","303"
"200.132.35.220","10.0.10.88","47908","HTTP","1046","HTTP/1.1 200 OK  (PNG)","316",""
"10.0.10.88","200.132.35.220","80","TCP","66","47908 > 80 [ACK] Seq=382 Ack=981 Win=31232 Len=0 TSval=3952670 TSecr=84695483","317","316"
"10.0.10.88","200.132.35.220","80","HTTP","458","GET /docencia1/manchesterDiferencial.png HTTP/1.1 ","318",""
"200.132.35.220","10.0.10.88","47910","TCP","66","80 > 47910 [ACK] Seq=1 Ack=393 Win=30080 Len=0 TSval=84695485 TSecr=3952671","319","318"
"200.132.35.220","10.0.10.88","47910","HTTP","1170","HTTP/1.1 200 OK  (PNG)","320",""
"10.0.10.88","200.132.35.220","80","TCP","66","47910 > 80 [ACK] Seq=393 Ack=1105 Win=31488 Len=0 TSval=3952671 TSecr=84695485","321","320"
